{
  "$schema": "https://json-schema.org/draft/2020-12/schema",
  "type": "object",
  "properties": {
    "hero": {
      "type": "object",
      "properties": {
        "title": {
          "type": "string"
        },
        "image": {
          "type": "object",
          "properties": {
            "src": {
              "type": "string"
            },
            "alt": {
              "default": "",
              "type": "string"
            },
            "width": {
              "type": "number"
            },
            "height": {
              "type": "number"
            }
          },
          "required": [
            "src",
            "alt"
          ],
          "additionalProperties": false
        },
        "breadcrumb": {
          "type": "object",
          "properties": {
            "home": {
              "type": "object",
              "properties": {
                "label": {
                  "default": "",
                  "type": "string"
                },
                "href": {
                  "type": [
                    "string",
                    "null"
                  ]
                }
              },
              "required": [
                "label",
                "href"
              ],
              "additionalProperties": false
            },
            "current": {
              "type": "string"
            }
          },
          "required": [
            "home",
            "current"
          ],
          "additionalProperties": false
        }
      },
      "required": [
        "title",
        "image",
        "breadcrumb"
      ],
      "additionalProperties": false
    },
    "about": {
      "type": "object",
      "properties": {
        "images": {
          "type": "array",
          "items": {
            "type": "object",
            "properties": {
              "src": {
                "type": "string"
              },
              "alt": {
                "default": "",
                "type": "string"
              },
              "width": {
                "type": "number"
              },
              "height": {
                "type": "number"
              }
            },
            "required": [
              "src",
              "alt"
            ],
            "additionalProperties": false
          }
        },
        "videoUrl": {
          "type": "string"
        },
        "eyebrow": {
          "type": "string"
        },
        "title": {
          "type": "string"
        },
        "text": {
          "type": "string"
        },
        "features": {
          "type": "array",
          "items": {
            "type": "object",
            "properties": {
              "title": {
                "type": "string"
              },
              "text": {
                "type": "string"
              }
            },
            "required": [
              "title",
              "text"
            ],
            "additionalProperties": false
          }
        },
        "cta": {
          "type": "object",
          "properties": {
            "label": {
              "default": "",
              "type": "string"
            },
            "href": {
              "type": [
                "string",
                "null"
              ]
            }
          },
          "required": [
            "label",
            "href"
          ],
          "additionalProperties": false
        },
        "phone": {
          "type": "object",
          "properties": {
            "label": {
              "type": "string"
            },
            "value": {
              "type": "string"
            },
            "href": {
              "type": [
                "string",
                "null"
              ]
            }
          },
          "required": [
            "label",
            "value",
            "href"
          ],
          "additionalProperties": false
        }
      },
      "required": [
        "images",
        "videoUrl",
        "eyebrow",
        "title",
        "text",
        "features",
        "cta",
        "phone"
      ],
      "additionalProperties": false
    },
    "plans": {
      "type": "object",
      "properties": {
        "eyebrow": {
          "type": "string"
        },
        "title": {
          "type": "string"
        },
        "packages": {
          "type": "array",
          "items": {
            "type": "object",
            "properties": {
              "name": {
                "type": "string"
              },
              "href": {
                "type": "string"
              },
              "slug": {
                "type": "string"
              },
              "card": {
                "anyOf": [
                  {
                    "type": "object",
                    "properties": {
                      "src": {
                        "type": "string"
                      },
                      "alt": {
                        "default": "",
                        "type": "string"
                      },
                      "width": {
                        "type": "number"
                      },
                      "height": {
                        "type": "number"
                      }
                    },
                    "required": [
                      "src",
                      "alt"
                    ],
                    "additionalProperties": false
                  },
                  {
                    "type": "null"
                  }
                ]
              }
            },
            "required": [
              "name",
              "href",
              "slug",
              "card"
            ],
            "additionalProperties": false
          }
        }
      },
      "required": [
        "eyebrow",
        "title",
        "packages"
      ],
      "additionalProperties": false
    },
    "visionMission": {
      "type": "object",
      "properties": {
        "eyebrow": {
          "type": "string"
        },
        "title": {
          "type": "string"
        },
        "tabs": {
          "type": "array",
          "items": {
            "type": "object",
            "properties": {
              "label": {
                "type": "string"
              },
              "kicker": {
                "type": "string"
              },
              "title": {
                "type": "string"
              },
              "text": {
                "type": "string"
              },
              "image": {
                "anyOf": [
                  {
                    "type": "object",
                    "properties": {
                      "src": {
                        "type": "string"
                      },
                      "alt": {
                        "default": "",
                        "type": "string"
                      },
                      "width": {
                        "type": "number"
                      },
                      "height": {
                        "type": "number"
                      }
                    },
                    "required": [
                      "src",
                      "alt"
                    ],
                    "additionalProperties": false
                  },
                  {
                    "type": "null"
                  }
                ]
              }
            },
            "required": [
              "label",
              "kicker",
              "title",
              "text",
              "image"
            ],
            "additionalProperties": false
          }
        }
      },
      "required": [
        "eyebrow",
        "title",
        "tabs"
      ],
      "additionalProperties": false
    },
    "coreValues": {
      "type": "object",
      "properties": {
        "title": {
          "type": "string"
        },
        "intro": {
          "type": "string"
        },
        "items": {
          "type": "array",
          "items": {
            "type": "object",
            "properties": {
              "tone": {
                "type": "string"
              },
              "title": {
                "type": "string"
              },
              "text": {
                "type": "string"
              }
            },
            "required": [
              "tone",
              "title",
              "text"
            ],
            "additionalProperties": false
          }
        }
      },
      "required": [
        "title",
        "intro",
        "items"
      ],
      "additionalProperties": false
    }
  },
  "required": [
    "hero",
    "about",
    "plans",
    "visionMission",
    "coreValues"
  ],
  "additionalProperties": false
}
